Title,Участники,Название по содержанию,Краткое содержание,Категории,URL,ID,Date (YYYY-M-D),Duration,Likes,Views,Comments
Практика самосострадания при переживании трагедии,"Дмитрий Исаев, Аня, Мария, Злата, Макс",Практика самосострадания при переживании трагедии,"Методика помощи себе в условиях трагедии (война, утрата). Разбор концепции «самосострадания» Кристин Нефф: доброта к себе, понимание и внимание. Отличие самосострадания от жалости и слабости. Обсуждение этапов горевания и важности эмпатии в терапевтической группе. Анализ чувств вины, обиды и стыда.","самопомощь, психология, трагедия, сострадание, эмоции",https://www.youtube.com/watch?v=GfrUfQwKi-s,GfrUfQwKi-s,2024-3-25,1:00:45,8,97,0
18 марта 2024 г.,"Дмитрий Исаев, Надежда (Надя)",Психология соцсетей: от поиска друзей до зависимости,• Жизнь в путешествиях и удаленная работа. • Соцсети как инструмент поиска друзей в эмиграции: разница между знакомыми и близкими. • Психологическая пропасть между реальным «Я» и онлайн-аватаром. • Феномен хейтинга и природа токсичных комментариев. • Цифровая гигиена: как сократить экранное время и бороться с дофаминовой зависимостью.,"психология, социальные сети, самооценка, общение, коучинг",https://www.youtube.com/watch?v=VEPFG7BWu7g,VEPFG7BWu7g,2024-3-18,1:35:58,10,96,0
Опасные цифры в жизни каждой семьи,Дмитрий Исаев,Магия цифр и кризисы семейной жизни,"Краткое пояснение о цикличных кризисах в браке (5, 10, 15 лет) и возрастных рубежах (38 лет у мужчин, 29 лет у женщин). Рекомендация обращаться к специалисту в периоды «рифм» семейной жизни.","семейная психология, кризисы, отношения, брак",https://www.youtube.com/watch?v=opnL5ANP1Xw,opnL5ANP1Xw,2023-9-12,0:58:34,4,95,0
25 июля 2023 г.,Дмитрий Исаев,Природа желаний и отличие от воли,"Беседа о механизмах возникновения и реализации желаний. Автор разграничивает понятия «желание» и «мечта», а также противопоставляет желание волевому усилию. Приводятся примеры из медицинской практики (случай медсестры Ксюши) и личного опыта обучения языкам. Обсуждается роль страха одиночества как препятствия к искреннему желанию близости.","психология, мотивация, философия, саморазвитие",https://www.youtube.com/watch?v=-pobVZmbacE,-pobVZmbacE,2023-7-25,1:18:52,4,92,0
Эмоциональное и профессиональное выгорание.,"Дмитрий Исаев, Михаил Михайлов",Способы восстановления ресурса и искусство неделания,Причины потери смысла в работе и отношениях. Практика «замедления» и осознанного одиночества. Обыденность как способ заземления. Риски медикаментозных стимуляторов.,"выгорание, депрессия, отдых, ресурс",https://www.youtube.com/watch?v=qgTEH2qxNx4,qgTEH2qxNx4,2023-11-28,1:07:39,4,85,0
10 октября 2023 г.,"Дмитрий Исаев, Михаил",Жизнь в Израиле после начала войны 7 октября: Психологическая устойчивость и этика выбора,"Обсуждение личного опыта первых дней войны в Израиле. Дмитрий рассказывает о переходе из мирного состояния в военное, находясь на отдыхе в пустыне. Темы: психологическая устойчивость (состояние «аттай»), отсутствие паники, поддержка близких. Обсуждается этика выбора между добром и злом, механизмы самооправдания при совершении зла и природа «бытового вранья» как способа защиты самооценки. Дискуссия о ненависти к врагу и сохранении человечности.","психология, этика, война в израиле, саморазвитие, философия",https://www.youtube.com/watch?v=mUeFD6_JuPg,mUeFD6_JuPg,2023-10-10,1:15:30,3,85,0
31 августа 2023 г.,Дмитрий Исаев,Отдых от цифрового поводка,"Короткое размышление о пользе намеренного отказа от телефона. Автор делится личным опытом «забывания» гаджета для снятия стресса, обретения ясности мыслей и принятия важных решений.","цифровая гигиена, психология, осознанность, отдых",https://www.youtube.com/watch?v=h2PZrsta8_4,h2PZrsta8_4,2023-8-31,1:12:28,3,75,0
"Беседа о душе, природе человечности.","Дмитрий Исаев, Михаил","Душа, Личность и Психика: Структура человека и природа любви","Разделение понятий тела, психики, личности и души. Потребности каждой структуры: психике нужны реакции, личности — реализация, душе — любовь и одушевленность. Обсуждение связи психосоматики с подавленными эмоциями. Философский взгляд на Бога как любовь и на душу как часть Бога, проходящую уроки боли. Чудо как категория души и феномен квантовой физики. Дискуссия о том, все ли люди являются «людьми» по своим поступкам и выбору.","психология, философия, психосоматика, духовность, антропология",https://www.youtube.com/watch?v=9PUN5v-19cA,9PUN5v-19cA,2023-10-24,1:12:09,5,70,0
19 декабря 2023 г.,"Дмитрий Исаев, Александр Каретный",Личность психотерапевта: путь Дмитрия Исаева,"• Биографическое интервью Дмитрия Исаева. • Влияние семьи и дедушки-филолога на становление личности. • Опыт работы в медицине, рок-музыка и выбор пути психотерапевта. • Три брака как три этапа взросления и личной трансформации. • Эмиграция в Израиль: осознанный выбор и новые смыслы в зрелости. • Литературный блиц-опрос: субъективная оценка классиков и современников.","биография, психотерапия, самопознание, философия, литература",https://www.youtube.com/watch?v=p1RN3ZxUd5k,p1RN3ZxUd5k,2023-12-19,1:41:38,2,60,0