Num,URL,Title,Date,Full Content,Categories,Tags
207,https://dsisaev.livejournal.com/62198.html,Сценарные типы. Третья серия. Человек Радуй.,"December 5 2013, 16:03","Я - последняя буква в алфавите.
Советская поговорка.
Я - это ты. Ты - это я.
И никого ни надо нам.
Все что сейчас есть у меня
Я лишь тебе одной отдам.
Российская попсовая песня.
Исполнитель этой песни Мурат Насыров погиб в январе 2007 года в Москве, при падении с балкона. По официальной версии это было самоубийство в состоянии депрессии. Жена артиста настаивает на несчастном случае.
Радуй других - это не только проверенный способ выживания в жестоком и враждебном мире, но и смысл этого выживания.
С самых первых дней ребенка учат жить для других. Своим примером и наставлениями. ""Ложечку за маму"" - причем здесь твой аппетит? Твое существование подчинено другим. Ты - для того, чтобы радовать.
Пятерка - для бабушки, посуду помыть - для папы, зубы почистить - для мамы.
Потом - дети - для мамы (внуков давай!), оргазм - для мужа (тебе хорошо со мной?), время - для работы, пенсия - для уже своих внуков.
Главный вопрос - ""кому я нужен?"". Вопрос - ""кто нужен мне?"" - является абсурдным и не рассматривается.
Все усилия Человека Радуй направлены на обслуживание интересов другого. Почему не заботы? Забота делает человека (ребенка, например) более самостоятельным и независимым. Более свободным, а значит - счастливым. От заботы - хорошо.
Опека, обслуживание - обязывает человека. Делает его должником и вовлекает в зависимость.
Забота родителей - чтоб ребенок смог сам. Без них.
Опека - ограничение любых собственных, свободных решений, самостоятельных поступков и сохранения зависимости от.
Забота - проявление близости, искренности. Обслуживание - игра, манипуляция для получения вознаграждения.
Чем душевнее прогнешься, тем больше чаевые.
Узнать, услышать в себе Человека Радуй очень просто. Например, через свое мыкание.
От ""мы какаем три раза в день"" и ""у нас две тройки в четверти"" до ""представляете, мы любовницу завели!"" и ""мы никак на работу не устроимся"".
""Я"" - абсолютное производное ""Мы"". Отсюда - ""я без тебя не могу"",
и мучительное - ""я тебе больше не нужна?!""...
Казалось бы - жить с Человеком Радуй удобно и выгодно. Ни в коем случае.
За этим девизом - всегда упрек. Долг неоплатный. Я же вам (мужу, детям, ученикам) всю жизнь отдала, себя не жалела, для себя не жила, все вам - а вы... С Человеком Радуй всегда чувствуешь некоторый стыд. Всегда немного (а то и по полной) виноват. Ибо.
Человек Радуй - Человек Обида. Совершенство с Сильным - виноватые чаще, сами что-то не так, а Радуй - всегда безупречен. В своем самопожертвовании.
И обижен в недооцененности.
Знаете, когда женщина Радуй дождалась мужика вечером с работы и силится его - правильно - накормить.
Она, чаще депрессивная, несчастная - весь вечер готовила, ему, ему только - у самой аппетита-то нет.
И вот он сел за стол, а она ему - тарелку протягивает, кушай - говорит тихим сладким голосом и ТАК смотрит, что не кушать хочется, а надеть эту тарелку ей на голову и так хлопнуть дверью, чтоб безвозвратно..
Есть такой симптом в психиатрии - Симптом собачьих глаз - называется. Симптом Человека Радуй.
Когда мужик уйдет (или сопьется, вариантов не много), она все усилия сконцентрирует на ребенке. Ему-то хлопнуть дверью труднее будет.
Поэтому, например, у ребенка Человека Радуй очень высока вероятность стать Ребенком Наркоманом. Мама ж за него живет, и лечиться за него будет, и умрет за него обязательно - как ему кажется. ""У нас доза уже пол грамма в сутки"" - ее же слова..
И ждут Человека Радуй не награды и почести от благодарных опекаемых - а злость и разочарование, раздражение, одиночество и ненависть. И вечный упрек ко всем близким - ЭГОИСТЫ!! И единственный эпитет к людям - НЕБЛАГОДАРНЫЕ!!
По соматическим типам - это, конечно, Язвенники. Реже - Лишний Вес.
По клиническим - Неврастения чистой воды. С переходом на затяжную Депрессию.
По сексуальным - Тетка Советская Обыкновенная. (спаси Господи ее душу).
Я пишу про Человека Радуй из женского рода. Это не значит.
Существо Радуй пола мужского существует в не меньших количествах и вызывает у меня, например, тошноту и агрессию. И имя ему - Коллекционер, и вырос он в семье такой же мамы, от которой пил, или ушел его папа.
Вырос с бабушкой, за которую - ложечку. И - ложечку за маму, она ж так устает с тобой, скотина, чтоб ты мне был здоров..
И единственный вариант при обнаружении. Если и возникает в голове - Радуй - то только один выход - Радуй Себя.
Это очень верный способ. И тебе хорошо, и близким. Рекомендую.",Психология,"Роли, Сценарии, Обида, Вина, Отношения, Терапия, Зависимость"
208,https://dsisaev.livejournal.com/62346.html,"ОДИССЕЯ В ИЗРАИЛЕ, АПРЕЛЬ.","December 17 2013, 13:05","ВНИМАНИЕ!!
Определились сроки проведения апрельской ОДИССЕИ В ИЗРАИЛЕ!
Проект состоится с 20 по 28 апреля 2014г.
Для участия необходимо сдать деньги на билеты в сумме 18.000 рублей.
Количество участников ограничено, но возможность участия пока есть.
Все вопросы по телефону 8 927 202 8626.
Нас ждет незабываемое путешествие по удивительной стране.  Иерусалим, средиземное море, Галилея.
Проживание в национальных парках Горен и Адамит, горы, пещеры, рыцарские замки северного Израиля.
Это психотерапевтический проект, где вы сможете лучше узнать себя, свои возможности, найти путь решения своих повседневных проблем, проблем со здоровьем, пообщаться с интересными людьми, получить помощь квалифицированных психотерапевтов и психологов.
Не упустите.","Места, Психология","Израиль, Группы, Терапия"
209,https://dsisaev.livejournal.com/55183.html,"Путешествие. Часть 1. Франция, Cap d'Agde.","August 22 2013, 16:45","Там можно все. Ограничение жесткое только одно - запрещена фото и видео съемка. По понятным причинам. Кап д'Аг - крупнейший европейский натуристский центр. Там есть все. Кроме интернета. Чтобы его получить, нужно было куда то идти и дорого платить. Не пошли. Наверное, это правильно. Долетели до Марселя (о нем - позже), и - сразу на прокатной машине двинулись в сторону Лангедока - это южный регион Франции, граничащий с Испанией. Проезжали через живописные Ним, Арль, Монпелье. Дальше - к морю. Как съехали с платной трассы - встряли в пробку. Мертвяцкую. Все - на море. Вся Европа, по ощущениям. И, именно сюда. Суббота была, вечер. Это - целый город, три огромных гостиничных комплекса, частные виллы, шале, маленькие дорогие отельчики, несметное количество прицепов и иных домов на колесах, большой палаточный город, да и просто желающие посетить это место на один день. Большущая очередь для желающих. 20 евро - проходи. Вот наш отель. Нам повезло - вид на море. Апартаменты - кухня своя, и продукты в шаговой доступности - все свежее и вкусное.
С балкона - потрясающие виды, особенно во время заката. Днем все на море. Все и всех возрастов. Семьями и компаниями. Очень мирно и доброжелательно. Никаких понтов  - все одинаково голые. Вот такой лазурный берег. Ну, фоткал, втихаря, конечно, на память. Исключительно добрую. Питались качественно и вкусно. Много питались. Если честно. Вот - вариант морского обеда. Вечером - иное.  Похоже на карнавал. Люди наряжаются в максимально эротические одежды, которые повсюду продаются в местных магазинчиках. Люди всех возрастов и сексуальных предпочтений. При этом. Ни одного пьяного мы не видели. Из алкоголя - вино, реже пиво. Крепкое - просто не принято. Почти никто не курит. Натуризм - не просто голыми ходить, это - способ жизни и отношений. Не путайте с нудизмом. Ни одного проявления агрессии. Просто не возможно. При максимальной эротической насыщенности. Каждый - что хочет. Кто-то поет хором французские бардовские песни, кто - отплясывает на дансингах, кто - переходит из ресторана в ресторан, сравнивая,  кто - на свинг пати, кто в пене танцует, шлепаясь и хохоча. Сначала крышу, конечно, покачивает. А утром - пробежки вдоль моря с наушниками или без, шезлонги, загар - все тихо - мирно. И взрослые дядьки строят своим малым детям (да и себе, конечно) огромные песчаные замки, скульптуры и просто куличики. После обеда (сиеста) - баиньки. Чтобы вечером - опять  квас-керогаз...Хорошо там. Может - и скопище греха, садом с гоморрой. Только нет там злости. Никто никого не учит, как правильно. Никто не упрекает и не осуждает. Нет разрыва поколений. Добрая там атмосфера. Во многих ""святых"" местах - гораздо злее. Много инвалидов, колясочников. Много совсем старых людей. Многие - после разных операций. Есть толстые и худые. Стройные и не стройные, загорелые и бледные. Очень разные языки. Цвета кожи и разрезы глаз. При этом - все - одинаково люди. Как в раю. Опять туда хочется. Билеты нужно бронировать после Нового года. Очень популярное место. Live, like us, undress yourself.","Места, Стиль, Психология","Франция, Стиль, Еда, Эмоции"
210,https://dsisaev.livejournal.com/55364.html,"Путешествие. Часть 2. Испания, Figueras.","August 23 2013, 23:17","Первая попытка попасть к Мастеру была предпринята прошлой зимой. Мы отвели специальный день для этого, приехав из Барселоны. Приехали. В единственный в неделю выходной день. Не просто - просто попасть к Мастеру. Нужны усилия - препятствия.
Развернулись и поехали обратно. Но адрес в навигаторе остался.
В этот раз мы были на том же расстоянии, только с другой стороны, во Франции. И отвели специальный день. И знали про выходной. И добрались. И были приняты в гости.
Мавзолейная очередь. Больше часа стояли. Есть короткое видео в моем профиле ютуба, там можно посмотреть -
http://www.youtube.com/user/dsisaev1
Есть в ожидании польза. И вот мы у.
Некоторое содержание и впечатления дальше.
Удивительный дом. Там он рос, жил в зрелости, работал, отдыхал. И покоится здесь же.
Его театр начинается со двора, куда попадаешь, как в чей-то сон.
Я не большой знаток искусств. Но внутренние ощущения были сильными. Ото всего.
Детские страхи ребенка.
Знаменитая картина - комната.
Целостное изображение получается, когда смотришь на нее в большую линзу на специальном помосте. Туда - очередь.
Получается такая картина.
Ну и нам, как настоящим советским туристам нужно было приобщаться.
Фотография в его духе. Случайно получиЛось:
У шедевров.
Убойная пародия на ватиканскую Сикстинскую капеллу на потолке:
Много совершенно неизвестных вещей, особенно графики. Гениальность - обязательно в отклонении. Но далеко не всякое отклонение - гениальность.
Он завещал остаться среди своих картин, среди своей красоты, внутри своего созданного мира. Это - вполне в его духе.
Внутри одного из залов - он сам. Навсегда.
Сначала - недоумение, оторопь.
Потом - нормально, свободный человек - он и посмертно свободен. Где хочет - там и есть.
Мне очень понравилось, Мастер. Похоже, не последний раз я в этих гостях.
Еще хочу.","Места, Культура, Психология","Испания, Живопись, Личность"
