Num,URL,Title,Date,Full Content,Categories,Tags
96,https://dsisaev.livejournal.com/17589.html,Зелено-желтый патруль.,"May 14 2012, 14:53","Приехали вчера на родное. Оно стало такое зеленое, не пролезть.
И стали косить, естессственно..
На территории обнаружились пришельцы. Вернее, прилетельцы. Их было много, над мойкой, на лестнице, прислоненной к бане. Нагляк полный.
Их мамашки улетели, испужавшись не по делу. Сели поодаль, и давай трещать - орать недовольно, перестав при этом кормить этих проглотов напрочь. А если их не кормить пару часов, ласты склеют желторотые, обязательно.
Жалко их стало, недоумков. Пришлось кормить их, как родных.
Накормили. И покосили, кто ж за нас? Поужинали, по капельке, конечно, да гулять пошли по селу, к озеру. Красота, даже комары не помеха после капельки - то. И уснули.
Утром вышли, птицы на месте, сидят на своих оболтусах, ждут, когда мы свалим.
Домой вернулись уставшие и довольные, как положено.",Места,"Самара, Природа"
97,https://dsisaev.livejournal.com/17911.html,Как стать счастливой.,"May 16 2012, 00:08","Ее папа - алкоголик.
Она пришла пять лет назад на группу решать проблемы своей жизни. С большущей обидой на родителей. На маму. На папу - алкоголика.
Она пришла на группу сегодня. Рассказала - в перерыве, потихоньку, не для публики:
- Я папе машину купила. Шестерку, живую, на ходу. Он в деревне живет, все время покупал убитые москвичи, мучился, чинил их по полгода, ездил два дня, и снова..
Я купила ему, он такой счастливый.. Звонит теперь, рассказывает куда ездил. Говорит, что любит меня.
Теперь с мамой решать нужно.
Решит. Направление верное. С обидой так и нужно. Можно виноватой стать пожизненно и наказывать себя, чтоб обиду эту заглушить. Одиночеством мучительным, еще более невыносимым семейным несчастьем. Себя наказывать,  а родителей обвинять.
А можно, как она. Папе машину купить. Шестерку, на ходу.
Posted via
LiveJournal app for iPad
.","Личное, Психология","Родители, Отношения, Вина, Обида, Радость"
98,https://dsisaev.livejournal.com/42047.html,Женские роли. Первая серия. Администратор.,"January 23 2013, 00:45","Я не ставлю себе задачу классифицировать женщин. Упаси Бог. Женщина достойна любви и уважения.
Мне интересно описать несколько социально - психологических ролей, с которыми я часто сталкиваюсь в психотерапевтическом кабинете и в обыденной жизни. Конечно, их гораздо больше. Женщины, заболевшие этими ролями достойны сочувствия и помощи.
Важно эти роли обнаружить в себе, чтобы иметь свободу от них отказаться.
Я выбрал три роли для ближайших серий:
Женщина - Администратор
Женщина - Директор
Женщина - Тетка Советская (обыкновенная).
Начнем с Администратора. Это женщина дождалась своего принца. Только не стала принцессой. Принцесса - это врожденное. А здесь нужно еще как потрудиться. Чтоб заполучить место.
Главная наживка и паутина Администратора - ощущение комфорта. В начале отношений будущий Администратор - идеальная обслуга.
Когда-то, лет в 12, оторопев от кошмара отношений папы и мамы она решила, что будет жить иначе. Что она добьется эволюции гадкого утенка (гадкой семьи, района, нищеты, тп) в прекрасную лебедь и утрет нос всем (совершенно всем) одноклассницам, соседкам, подружкам - кому повезло больше от рождения. Кому  завидовала и перед кем комплексовала.
Для этой эволюции она вырезала у себя все, способное к любви и близости. Чтобы стать сильной.
В какой то момент она напоминала мужчину - Охотника. Не жалела времени, сил и средств для отлова Принца. Принцы чаще попадались в виде банальных мажоров, оглохших и ослепших от родительских денег.
Окучивание принцев происходило методично, без спешки - суеты, наверняка.  Охреневший от количества фальшиво-селиконо-гламурных женских особей, Принц - мажор вдруг замечал, что рядом - постоянно - что-то настоящее, реально заботливое, теплое, читающее умные книжки, безотказное существо, совершенно не требовательное, не ревнивое и (главная наживка Охотника) - понимающее. С этим существом все просто, понятно и комфортно.
К свадьбе все сводилось как бы само собой, вряд ли кто-то мог вообразить колоссальные моральные и физические затраты Охотницы для достижения это смешной, глупой и трогательной процедуры. Свадьбы, то есть.
Только после свадьбы Охотница не теряла интереса к добыче, она  превращалась в Администратора.
Она сохраняла для него идеальную (комфортную) обслугу. Она распоряжалась бытом, воспитанием детей (не сама, чаще с привлечением нянек - гувернанток - репетиторов), отношениями с родственниками, становилась негласным менеджером по персоналу в бизнесе Принца, была его психологом, наркологом, венерологом и подобное.
Она его не контролировала, не вылавливала с бабами, она допускала любые его косяки. Она становилась для него всем.
Она его никогда не любила. Иначе не смогла бы быть такой удобной.
Взамен она получала свою награду. Она получала, и совершенно заслуженно, возможность и средства утереть нос тем самым, во дворе и в классе, тем, кому больше повезло от рождения.
Она стала богатой, социально значительной и неуязвимой. Подавитесь.
Когда ее спрашивает подруга, откуда у нее, например, новая дорогая шмотка, она отвечает - Это небольшой косяк Любимого. За большой косяк - вещь покруче.
Когда ее подруга расскажет ей о своей влюбленности, она ответит ей с нескрываемой ухмылкой превосходства - Да ты чё, он же - пустой.
Пустой, понятное дело, это - бедный. Иные качества Администратора не интересуют. Тем более, такая возможность унизить ближнюю.
В этом смысл. Быть выше, круче, значимее. Не зря же столько усилий. Шмотки, машины, драгоценности - не для мужиков, для подруг по серпентарию.
Если в дорогом ресторане вы увидите стол, за которым сидят исключительно женщины, богато одетые, смеющиеся чуть громче приличного, пьющие чуть больше приличного и измеряющие линейкой друг другу каратники на пальцах, знайте - это тусовка Администраторов. К ним не нужно подходить. С ними бесполезно знакомиться. Они собрались для своего самого главного. Не отвлекайте.
Проблемы у Администраторов - проблемы людей, живущих в безлюбье. Высокая тревога нереализованной близости компенсируется алкоголизаций, всяческой гинекологией, паническими приступами и прочими неврозами.
А главное - отвратительным страхом потери всей этой мишуры, ради которой они себя так жестко удушили.
Posted via
LiveJournal app for iPad
.",Психология,"Сценарии, Личность, Игры, Манипуляции"
99,https://dsisaev.livejournal.com/42324.html,Женские роли. Вторая серия. Директор.,"January 25 2013, 01:36","Женщина - Директор встречается в моей жизни и практике чаще Администратора. Она не стесняется приходить на прием к психотерапевту или на групповые занятия. Ей очень нужно быть в тонусе. Ей нужны силы.
Ей интересно узнавать про себя, а еще интереснее - про людей, их поведение и реакции, про социальные аспекты человеческого взаимодействия. И я понимаю, что нужно ей это, помимо прочего - для дела.
Она не ждала и не искала принца. Он ей, по сути, не нужен. Она - сама.
Она не пользуется ни приманками, ни мышеловками,  ни паутинами.  Мужчины сами стремятся находиться с ней по-близости.
С ней надежно. С ней - понятно и уверенно. Ведь она - их Директор.
Родом Директор - из обычной семьи. Там было все - и ссоры, и любовь, и всякие разные испытания.  Это была очень не богатая семья. Часто - бедная. Но, доживая до получки, привозя колбасу и шпроты из Москвы и пряча зеленые бананы на шкаф, чтоб дозрели - девочка в этой семье чувствовала себя любимой. В этой семье в нее верили.
Не ставила она цель - разбогатеть любой ценой, возвыситься властью в обществе - ей нужно было только оправдать это доверие.
Поэтому, после неизменного Планового ( ну, пусть Политеха, ладно) она не долго думала - оставаться в теплом заводоуправлении или рисковать. И тут Бог ее отправил в самые, что ни на есть - ДЕВЯНОСТЫЕ.
Она прошла через все. Она стала гибкой и сильной. Ее не сломали ни бандиты, ни гос-бандиты.  Она заработала деньги и их сохранила. Она построила свою империю и защитила ее. И не важно, продавала ли она самолеты, нефть или молоко в ларьке. Империя держалась на ней.
Мужчины были в помощниках. У нее есть муж. Не смотря на громкие должности на визитках, муж был - личным водителем и экспедитором.
Любила ли она его - трудно сказать, некогда ей было. Дел полно. Большая империя.
Родители, родственники, родственники мужа, родственники родственников своих и мужа, все были рядом, все кормились. Поругивая при этом негромко Директора от зависти и собственной неполноценности. Лицемерили, сплетничали, врали. Но кормились исправно.
Подруги у нее - такие же ДиректорА.  К Администраторам (женам богатых мужиков) относилась с нескрываемым презрением.  Другая каста.
С подругами могла себе позволить душу отвести - и песняка погорланить, и повыть белугой. Пить научилась крепко. Только, чтоб никто не видел, только со своими, и не в ущерб Делу. С утра - как штык.
Но уж если отрывались..
Плавал я один раз на пароходике с Обществом Деловых Женщин Самары, незабываемо. Сразу, за завтраком - по полстакана водки. Как на поминках. Закусили икорочкой, и - еще по столько. И - понеслась. И танцы, и слезы, и смех до слез, и опять по водочке, весело, в общем. Еле жив остался. Со многими - дружу до сих пор.
Директор никогда не будет наряжаться новогодней елкой, как Администратор. У нее, как раз, нормальная самооценка. Наряжаться будет - ее сын.
Да, часто Директор странным образом временно превращалась в Сумасшедшую Мамашку. См
http://dsisaev.livejournal.com/12935.html
Удивительно, но у всех моих знакомых Директоров - именно сын. Единственный. Отстрелялась, и хорош - на работу.
Сын у нее единственный, но совершенно не оправдывающий. Очень часто - катастрофически бестолковый. Но всегда - искренне и болезненно любимый.
Она в него вложила все. От учителей - репетиторов, Сорбон - Оксфордов, в которых он не доучился, до денег больших, достаточных - открывай дело свое или мое продолжай, ну!
Нет. Не знавший с детства ни одной проблемы, оглохший от маминых денег и подхалимажа родственников и учителей, ее надежда вырастала в совершенно бесхребетного мажора. И ее боль и разочарование.
Выросших сыновей сцапают Администраторы, а она все  будет думать - где ж она промахнулась? Что не так делала, не так воспитала? И обязательно возьмет на себя - вину.
Самое страшное для Директора - стать Бывшим Директором. Может, и смогла бы она научиться ничего не делать где-нибудь в средиземноморском домике, да как же сын? Да как же вся империя, все ее подданные, все то - ради чего..
Не для себя же жила, понятное дело. Хотя жила, надо сказать - достойно.  Осталась только - с чувством вины и ощущением чего-то утраченного, чего-то важного непережитого..
Она придет с гипертонией или паническими атаками, с просьбой о сыне или просто - поговорить - душу выплакать. Плачет по настоящему, без показухи, мгновенно строгим голосом переключаясь на постоянные звонки всех трех ее телефонов, которых она - ну никак не может выключить, понимаете, доктор?
Она будет ходить на консультации, ни разу не опоздав. Она будет точно выполнять рекомендации. Она будет искренне и не скрываясь работать на группах, хотя ее знают практически все в этом городе. Ей очень нужно быть здоровой и сильной.
Столько дел у нее еще впереди..
Posted via
LiveJournal app for iPad
.","Психология, Социум","Сценарии, Личность, Терапия, Деньги"
100,https://dsisaev.livejournal.com/18174.html,Каникулы.,"May 25 2012, 23:29","Сегодня кончился учебный год у младшего сына. Неплохо, лучше, чем в прошлом году.
В 22.05 он лег в постель.
- Нормально! - сказала жена - а кто ужинать будет?
- Бегом на кухню - поддержал я. Залезай в холодильник, доставай и ешь.
- Потом -  (жена) - пить и в телефон играть!
- Потом - я - пока три раза в туалет не сходишь - к кровати не подходи!
(Через полчаса)
- Кто свет разрешил выключить, а? Только попробуй мне!
-  Телевизор погромче, не слышно ни хрена, я кому говорю, погромче, мне чо, самому подойти!!!!
. Почему кот не под одеялом???!!!
- Тебе еще два раза в туалет!!!!!!!!!!!!!!!
- Иди пей давай, еще три разааааааа!!!!!!!!!!!!
- Так ведь лопну.....
-Тогда бегом в туалет!!!!!!!!!!!'$$$$$$$@@@@@@@&&&&&&&///////;;;
Каникулы, сынок, они для родителей. Они так долго этого ждали. ПОПРОБУЙ ЗАВТРА ВСТАТЬ РАНЬШЕ 12, любимый наш!
Posted via
LiveJournal app for iPad
.",Личное,"Дети, Семья, Радость"
101,https://dsisaev.livejournal.com/18386.html,Зеленый патруль. Продолжение.,"May 31 2012, 13:45","Слава Богу, они успели. Выросли и улетели. Как положено.
С чистой совестью приступили к зачистке. Очень жестко, но куда деваться - людей ведь вести. Да и самим после зачистки комфортнее. Я про комаров.
Вот и хорошо. Остальной животный мир не пострадал.
Ждем субботу, первый летний проект наш, аналитику. До скорых!","Психология, Личное","Терапия, Личность, Отношения"
102,https://dsisaev.livejournal.com/20997.html,Одиссея. Послесловие.,"July 9 2012, 16:58","Мистика. 4 раза писал эту заметку на айпаде и все разы при загрузке она исчезала. Слишком, наверное, эмоционально насыщенно. Попробую теперь здесь, на домашнем ноутбуке.
А писал я следущее:
Вернулись, проводив. Все еще живо, пространство наполнено людьми, с которыми за это время я прожил эту маленькую жизнь.
Как будто все здесь, и все продолжается. И сейчас опять соберемся. И будем с нетерпеньем ждать - Приятного аппетита! - Петь, соль передай! - как вкусно, Господи.. Как хорошо, когда ты рад, и тебе рады те, кто рядом.
Но нет. Это все здесь, но, увы, не сейчас.
Побродил, наводил порядок на территории и в душе, а в голове - по кругу, застрявшее:
Наша жизнь не приемлет в себе постоянства,
И прощаться легко, только некая грусть
Занимает в душе небольшое пространство,
Если сверху смотреть на отмеренный путь.
Ведь прощаемся мы не с людьми, не с местами,
И не в том ( между нами ) расставания суть.
Всякий раз мы прощаемся с нашими днями -
Что уже не вернуть.
Это Макар.
А это мы, то, что успел снять на телефон, профессиональные фотографии будут позже.
Живем дальше, внимательно, чтоб не пропустить колокол, собирающий вместе.","Личное, Психология","Семья, Брак, Игры, Манипуляции, Страх, Сценарии"
