Num,URL,Title,Date,Full Content,Categories,Tags
162,https://dsisaev.livejournal.com/53439.html,Клинические типы. Серия девятая. Человек Психопат.,"July 18 2013, 14:13","Вроде бы и строишь -
А все разлетается.
Вроде говоришь -
А все не про то.
Ежели не выпьешь -
Не получается.
А выпьешь - воешь волком.
Ни за что ни про что.
Б.Г.
Ад - это другие.
Сартр.
Человек Психопат - абсолютно здоров психически, такое противоречие. Мышление, память, восприятие - все в порядке. Только с людьми проблемы. С отношениями. И проблемы - неразрешимые. Есть более верный американский термин - социопат.
Олег Табаков про таких людей очень точно сказал - у них - рак совести.
А совесть - основа отношений. Весть о другом. Нравственное чувство. И если оно поломано - отношений не будет, и виноваты в этом буду другие.
По сему Психопат - Человек - Обиженный. А значит - безответственный. Самоизолирующийся от других. Виноватый - нет, тот будет искать выход, пусть через самонаказание, но искать. Психопат может быть обвиненный, но не виноватый.
- За что сидишь?
- Да ни за что!!
Про детство Психопата нельзя сказать что-либо определенное, закономерностей немного. Могут быть и гиперопека, и жестокое обращение, и отвержение. Я знавал абсолютного Психопата из прекрасной профессорской семьи. И видел их в приютах и детдомах. Есть теория о врожденных причинах, генетических нарушениях. Тут даже о реинкарнациях задумаешься. Никаких закономерностей. Откуда берется?
Но есть четкие признаки. Классические. Их три.
1. Тотальность. То есть - везде. Психопат не сможет построить отношений в любой сфере. Родители - гады- не додали, недолюбили.
Друзья - предатели, нету друзей. В лучшем случае - собутыльники, но тоже не надолго.
Женщины - все шлюхи, подлые и меркантильные дуры. И главная из них - жена. Жен может быть много, но не надолго. Он обязательно будет подтверждать, что она такая и есть. И подтвердит. И другая такая же будет. Есть, конечно, героини, живущие с Психопатами долго и несчастно. Но этот подвиг никогда не получит награды. Только синяки и отчаяние.
Сотрудники - подлецы и воры. Начальники - негодяи и мерзавцы. Все они сговорились против. Чтоб навредить. Психопат не сможет долго удерживаться на рабочем месте. Даже в бандитской шайке. Часто годами будет висеть на чьей нибудь героической шее. Чаще - маминой.
Всегда найдутся виноватые в его неудачной жизни - евреи, кавказцы, американцы - кто угодно, только не он сам.
Если у Человека получится построить нормальные отношения хоть где-нибудь - в семье, на работе, политическую карьеру сделать - он не Психопат.
Гитлер, Сталин, Пол пот - это не Психопаты. Кровопийцы - да, но у них получилось построить отношения с ближайшим окружением и потом с народом на долгие годы. У них была ценность, вернее, сверхценность - власть, с помощью которой они компенсировали свою неполноценность. У всех диктаторов есть закономерности развития, и они похожи. Воспитание, отношение со сверстниками, неудачи с девчонками и даже невысокий рост. У Психопатов - нет.
У Психопата нигде ничего не получится.
2. Необратимость. То есть - всегда. Психопат навсегда останется Психопатом. Если даже в конце жизни он сможет полюбить и создать счастливую семью, стать своим среди друзей или найти свое место в профессии - значит он - не Психопат. Но не советую экспериментировать на собственной шкуре и жизни, надеясь на будущее с Психопатом. Они - и шкура и жизнь - у вас одни.
Не нужно выходить за Психопата замуж. Не спасете. Себя погубите. А признаки психопатии вы обязательно обнаружите до свадьбы. Не врите себе. Не верьте охапкам цветов после ударов по лицу. Все повторится. И с годами будет повторяться чаще. Это - медицинский факт.
3. Социально психологическая дезадаптация. То, что в быту называется Человек Неудачник. Он может даже как-то заработать много денег. Вернее - украсть. Так было в девяностые. Но где теперь эти красные пиджаки на жирных телах с цепями?
Он будет бросать, разводиться, садиться. Его будут бросать, подставлять и сажать. Его даже будут пробовать любить и ему помогать. Бесполезно. Обида все разрушит.
Можно помочь такому человеку социально компенсироваться. Направить его агрессивную энергию в полезное русло. Иногда хорошо получается. Но все равно, великий чемпион и Психопат Майк Тайсон будет насиловать женщин в кабаках и откусывать уши на ринге.
Тотально и необратимо.
В историю Психопат не может войти ни писателем, ни артистом, ни другим иным. Только убийцей Джона Леннона или Ицхака Раббина. Слава Герострата - сомнительная цель.
В литературе это герой Сартравской Тошноты или Достоевского Преступления. Или героиня его же Идиота. Это герои Паланика, Парфюмер Зюскинда и санитар Чеховской шестой палаты. Малоприятные личности.
По очень приблизительной статистике, процент психопатизации общества доходит до 25. Тут глаз да глаз. Правда, и в других обществах дела не на много лучше. Это онкология совести в цивилизационных масштабах.
Важнее обнаружить признаки Психопата - в себе. В своей обиде, злости и трусости. И склонности к обобщениям - все бабы, все начальники, все чурки.. Нет. Весь - только ты. И Психопат твой внутри. И выдавливай его по капле. И лучший способ - просить прощения. Обиделся - вперед.
Да, количество мужчин Психопатов и женщин Психопаток примерно равное. Чтоб не думалось.","Психология, Социум","Личность, Социум, Терапия, Общество"
163,https://dsisaev.livejournal.com/33183.html,Про трусость.,"November 1 2012, 23:39","..... а гроза будет только к вечеру, и трусость, несомненно, один из самых страшных пороков. Так говорил Иешуа Га-Ноцри.
- Нет, философ, я тебе возражаю: это самый страшный порок!
На группе сегодня актуализировалась тема. Вот такие размышления после:
Страх - нормальное и необходимое чувство. А вот реакция может быть разной.
Если страх - в неизвестном, и страх - преграда к развитию - личности или отношений, если страх - способ не принимать решения или оставить все как есть, без развития, то
Это верный повод идти к нему на встречу. Это то, во что необходимо войти, чтобы освоить.
Есть подсказки древних:
""Если есть два пути, и ты не знаешь, какой выбрать - двигайся туда, где страшнее."" Точно, еще не разу не подводило.
Чтобы страх не сковывал, нужно двигаться к нему навстречу.
Это называется - мужеством.
(Это не страх, возникающий перед прыжком с большой высоты или перед употреблением наркотиков. Здесь шкурой боишься. Природой своей. Это - страх социальный, из головы, страх потерять равновесие  при выходе из привычного болота - будь то заржавевший брак, где нет ни любви, ни заботы, будь то опостылевшая работа, где нет ни творчества, ни (само)уважения.)
Поведение, снижающее страх - трусость. Внутри или снаружи. В отношениях или в ремесле.
Трусость - обычно очень хорошо рационально обоснованна. В отличии от мужества.
Есть иллюзия, что трусость эффективнее. Что трусость выживает успешнее. Не-а.
Ничего не живет без развития. Медленно, но верно протухает. И человек, и семья, и коллектив, и государство. Мумию вряд ли стоит наградить за живучесть. Пусть даже она и копирует живые движения.
Мужество, прежде всего - обнаружить  в себе труса. То есть себя, снижающего страх развития. И страх потери.
Очень важная задача - найти свою трусость. И назвать ее своим именем.
Posted via
LiveJournal app for iPad
.","Психология, Личное","Травмы, Личность, Терапия, Брак, Работа"
164,https://dsisaev.livejournal.com/53759.html,Диалог о главном.,"July 21 2013, 22:05","Совершенно спонтанно и не постановочно, вся ответственность - на Алексее Бороде). Завтра опубликую его фильм про недавнюю нашу Одиссею.",Психология,Группы
165,https://dsisaev.livejournal.com/33496.html,Пилотный проект фильма про аналитику в Израиле.,"November 6 2012, 01:12","Это первоначальный вариант фильма, отснятого Алексеем Бородой, нашим израильским коллегой и соведущим проекта. Можно получить представление о будущем нашем апрельском маршруте. Со дня на день, как только поступят в продажу билеты в Тель Авив на апрель, объявим точную дату и будем собираться. Заявки вовсю собираются, и у нас, и в Израиле.
А пока - это видео. Спасибо Денису Коршикову за колдовство, позволившее, все-таки, это загрузить).","Места, Психология","Израиль, Группы, Терапия"
166,https://dsisaev.livejournal.com/33770.html,Удивительная история.,"November 7 2012, 22:16","У нее была строгая мама. Для мамы дети - было главное. А для ребенка главное было - образование. Это была абсолютная   истина.
Поэтому она была отличницей. Совершенно круглой. Я спросил ее, чем увлекалась помимо школы.
- Да ничем, ответила, уроки делала. Так оно, похоже и было.
И тут произошла удивительная история:
Она уверенно подошла к своей золотой медали. Со всеми пятерками. Но тут случилось неожиданное: в ее школу, вместо планируемых трех золотых медалей, выделили  две. По какой-то неведомой причине. Но, по вполне по понятной, социальной причине, ей этой медали не хватило.
Учительница пришла к ним домой. Вечером. И попросила переписать сочинение. С пятерки на четверку. Чтобы получить серебренную медаль.
- Да ненужно, вяло сопротивлялась она. Пусть все пятерки будут.
Но они ее уговорили. Вместе с мамой. Что это обязательно. Что это очень важно. Что она заслужила свою медаль.
Она переписала сочинение с ошибкой. И получила свою заслуженную серебренную медаль.
И пошла жизнь.. В полный рост и в том же направлении. У нее уже свои дети. Учит..
Много лет слушаю разные истории, изучаю судьбы, жизненные повороты. В каждой есть, чему удивляться. И даже диву даваться. И иногда, даже, офигевать, извините. Может, и слава Богу?
эм","Психология, Личное","Сценарии, Личность, Родители, Дети"
167,https://dsisaev.livejournal.com/34011.html,Проси прощания. После открытой консультации.,"November 10 2012, 00:19","Часто для родителей дети - единственный повод и способ остаться вместе. И дети - всегда - этому очень рады. Потому что если дети - единственный способ удовлетворения потребности в любви - то все подарки - им. Одна проблема - вырастают, гады. И уезжают, неблагодарные. Поэтому:
Чтобы не уехали, а если и уехали, то:
Сохранить возможность любить (опекать, контролировать, оберегать, дезинфицировать) - значит, сохранить зависимость - а это возможно если:
Привязать самыми крепкими - эмоциональными путами - несокрушимым чувством вины и абсолютным безверием в себя.
1. Мы для тебя сделали ВСЕ. (Ничего не жалели, все отдали, себя не щадили, здоровье сгубили, карьерой пожертвовали и тп.). Должен теперь. Пожизненно. Неискупимо.
2. Ты - беспомощен. Туп, глуп, слеп, нем, глух.  Полный профессиональный кретин.  Достоинбольшегочемэтоничтожество - это про того, в кого осмелился влюбиться. И самое главное:
Болен. На голову, на живот, на сердце - см дальше большую медицинскую  энциклопедию.
И ребенок - который всегда рад продолжать получать подарки - все это примет с глубокой благодарностью и удовлетворением.
И никуда не денется, хоть на другой континент его отправь.
Что делать? Ясно чего. Только очень трудно. Чувство вины мешает, как пудовые гири. Поэтому:
Необходимо прорваться через эту вину. Куда? К обиде. Она обязательно должна быть. Она есть. В связи с вышеизложенным. В связи с невозможностью почувствовать и выразить агрессию - на них, на мир. На себя только можно. На мир, на родителей - обида. И из этой обиды попросить - вольную.
Попросить прощАния. Отпустить эту обиду, и чувству вины не на чем будет быть. Тогда ты - свободен. В нашем языке прощание и прощение - суть одно слово, один смысл. Не прощенным не попрощаешься.
Родителям это грозит очень важной возможностью - столкнуться друг с другом, напрямую, без ребенка - заложника. И что-нибудь уже сделать, решить.
Это их дела. А ребенка главная забота - смочь без них. И если нужно, о них заботиться. Во вторых о них, во первых - о себе. Об этом еще Конфуций предупреждал. Дословно.
А если повзрослел - что уж болеть, какие уж панические атаки - жизнь так заворачивает - только держись. Есть что-то интереснее, чем подбор антидепрессантов и психологов.  Зуб даю.
Posted via
LiveJournal app for iPad
.",Психология,"Вина, Обида, Терапия, Родители, Дети"
168,https://dsisaev.livejournal.com/34102.html,Первый снег.,"November 12 2012, 00:12","Мы с трудом выбрались из города. Суббота, вроде, а все стоит. До икеи  плотняком. Мокрая трасса, грязь из под колес. Вылил весь бак омывателя на стекло. Уже подъезжали к Яру, Лешка сказал - вроде снег. Не поймешь, темно уже.
Заблудились, конечно. Ни разу к нему не было, чтоб не заблудиться. Покрутились по грунтовкам.
Он вышел на улицу, встретил. Запарковал. В дом повел.
Чуть перекусили (Лешка молодец, остановил обжиралово), и в баню.
Она у него знатная, правильная. Ну и оторвались, конечно.
От суеты городской оторвались, отмылись, отчистились паром да веники хороши оказались, и Лешка спец, как всегда.
Вернулись в дом - в легком головокружении и здоровом аппетите. Тут и еда. Тамара Ивановна наготовила чудесно. И мясо из духовочки, и солености из банок разнообразных, и хреновина - вырви глаз, и свекла с чесноком густым. И мед горно алтайский, необычный, мятный.
Ну и выпили, конечно. Он - коньяк, для сосудов, мы - вискаря, чтоб с мыслей и напрягов сплыть, к разговору подготовиться.
Нет больше удовольствия, чем с ним ""болтать"". Каждый раз - открытия.
И в эту ночь - их случилось.
Вот так и сидели.
Всю ее, конечно, не уговорили, так, потрепали малость.
Сын мой, вместо того, чтоб благоговейно слушать нас, гур великих, впитывать мудрость вечную и запоминать для потомков, засунул голову в планшет, и не высовывал, тем более, что у него в его природах вай фай приличный, как положено.
А потом вышли на двор, покурить им, а там -
Снег первый. Лег еще на траву зеленую, и как то так хорошо стало, что встретили мы первый снег в его доме, в атмосфере его, где воздухом - искренность и теплота.
Поздно спать легли, все ""болтали"".
Проснулись (снег лежит), каши навернули, и на двор, морозом дышать, шашлыки готовить. Хорошо.
Душевно получилось, вкусно. Мясом я заведовал, хвалюсь по делу.
Они еще по капельке, да опять про любовь и про Бога. А мне за руль. Засуетился, за светло бы доехать.
Объяснил, как выехать, рукой помахал. Я ему:
- До вторника, Георгич, спасибо за время.
- Пока, Дим.
Доехали без приключений.
В городе снега не было.
Posted via
LiveJournal app for iPad
.","Места, Личное, Психология, Стиль","Самара, Дружба, Семья, Эмоции, Природа"
